{
  "assessment_id": "RI01-ASM-001",
  "spec_version": "1.0.0-fc16",
  "assessment_type": "PARTIAL",
  "evidence_cutoff_time": "2026-09-09T06:30:00Z",
  "system": {
    "system_id": "SYS-RI01",
    "name": "API-Consumed Analytics Assistant",
    "material": true,
    "agentic": false,
    "model_sourcing": "api_consumed",
    "model_identifier": "provider-model-floating",
    "version_mode": "floating"
  },
  "risk_profile": {
    "impact": "I2",
    "autonomy": "A1",
    "reversibility": "R1",
    "scale": "S2",
    "velocity": "V1",
    "detectability": "D1",
    "likelihood": "L2",
    "uncertainty": "moderate",
    "affected_population": "internal_analysts",
    "data_sensitivity": "material_business_data",
    "external_change_exposure": "E3",
    "derived_band": "MATERIAL",
    "escalation_effects": []
  },
  "capability_results": [
    {
      "capability_id": "TEC-02",
      "result": "L2",
      "confidence": "C3",
      "eligible_levels": {
        "L1": true,
        "L2": true,
        "L3": false,
        "L4": false,
        "L5": false
      },
      "anchor_eligibility_trace": {
        "mode": "capability_specific",
        "max_supporting_evidence_class": "E2",
        "operating_cycles": 0,
        "adaptation_cycles": 0,
        "counter_evidence_refs": [
          "EVD-RI01-002"
        ],
        "levels": {
          "L1": {
            "eligible": true,
            "anchor_observed": true,
            "evidence_ok": true,
            "operating_cycles_ok": true,
            "adaptation_cycles_ok": true,
            "requirements_ok": true,
            "counter_evidence_ok": true,
            "missing_requirements": [],
            "failed_requirements": [],
            "insufficient_requirements": [],
            "minimum_evidence_class": null,
            "minimum_operating_cycles": 0,
            "minimum_adaptation_cycles": 0
          },
          "L2": {
            "eligible": true,
            "anchor_observed": true,
            "evidence_ok": true,
            "operating_cycles_ok": true,
            "adaptation_cycles_ok": true,
            "requirements_ok": true,
            "counter_evidence_ok": true,
            "missing_requirements": [],
            "failed_requirements": [],
            "insufficient_requirements": [],
            "minimum_evidence_class": "E1",
            "minimum_operating_cycles": 0,
            "minimum_adaptation_cycles": 0
          },
          "L3": {
            "eligible": false,
            "anchor_observed": true,
            "evidence_ok": true,
            "operating_cycles_ok": true,
            "adaptation_cycles_ok": true,
            "requirements_ok": false,
            "counter_evidence_ok": false,
            "missing_requirements": [
              "EAIMS-MSP-007",
              "EAIMS-MSP-008"
            ],
            "failed_requirements": [],
            "insufficient_requirements": [],
            "minimum_evidence_class": "E2",
            "minimum_operating_cycles": 0,
            "minimum_adaptation_cycles": 0
          },
          "L4": {
            "eligible": false,
            "anchor_observed": false,
            "evidence_ok": false,
            "operating_cycles_ok": false,
            "adaptation_cycles_ok": true,
            "requirements_ok": false,
            "counter_evidence_ok": false,
            "missing_requirements": [
              "EAIMS-MSP-006",
              "EAIMS-MSP-007",
              "EAIMS-MSP-008"
            ],
            "failed_requirements": [
              "EAIMS-MSP-004"
            ],
            "insufficient_requirements": [],
            "minimum_evidence_class": "E3",
            "minimum_operating_cycles": 2,
            "minimum_adaptation_cycles": 0
          },
          "L5": {
            "eligible": false,
            "anchor_observed": false,
            "evidence_ok": false,
            "operating_cycles_ok": false,
            "adaptation_cycles_ok": false,
            "requirements_ok": false,
            "counter_evidence_ok": false,
            "missing_requirements": [
              "EAIMS-MSP-006",
              "EAIMS-MSP-007",
              "EAIMS-MSP-008"
            ],
            "failed_requirements": [
              "EAIMS-MSP-004"
            ],
            "insufficient_requirements": [],
            "minimum_evidence_class": "E4",
            "minimum_operating_cycles": 2,
            "minimum_adaptation_cycles": 1
          }
        }
      },
      "higher_order_observations_preserved": [
        "L3"
      ],
      "blocked_by": [
        "EAIMS-MSP-004"
      ],
      "evidence_refs": [
        "EVD-RI01-001",
        "EVD-RI01-002"
      ]
    },
    {
      "capability_id": "OPS-02",
      "result": "L2",
      "confidence": "C3",
      "eligible_levels": {
        "L1": true,
        "L2": true,
        "L3": false,
        "L4": false,
        "L5": false
      },
      "anchor_eligibility_trace": {
        "mode": "capability_specific",
        "max_supporting_evidence_class": "E1",
        "operating_cycles": 0,
        "adaptation_cycles": 0,
        "counter_evidence_refs": [],
        "levels": {
          "L1": {
            "eligible": true,
            "anchor_observed": true,
            "evidence_ok": true,
            "operating_cycles_ok": true,
            "adaptation_cycles_ok": true,
            "requirements_ok": true,
            "counter_evidence_ok": true,
            "missing_requirements": [],
            "failed_requirements": [],
            "insufficient_requirements": [],
            "minimum_evidence_class": null,
            "minimum_operating_cycles": 0,
            "minimum_adaptation_cycles": 0
          },
          "L2": {
            "eligible": true,
            "anchor_observed": true,
            "evidence_ok": true,
            "operating_cycles_ok": true,
            "adaptation_cycles_ok": true,
            "requirements_ok": true,
            "counter_evidence_ok": true,
            "missing_requirements": [],
            "failed_requirements": [],
            "insufficient_requirements": [],
            "minimum_evidence_class": "E1",
            "minimum_operating_cycles": 0,
            "minimum_adaptation_cycles": 0
          },
          "L3": {
            "eligible": false,
            "anchor_observed": false,
            "evidence_ok": false,
            "operating_cycles_ok": true,
            "adaptation_cycles_ok": true,
            "requirements_ok": false,
            "counter_evidence_ok": true,
            "missing_requirements": [
              "EAIMS-EVL-003",
              "EAIMS-EVL-005",
              "EAIMS-EVL-006",
              "EAIMS-EVL-009"
            ],
            "failed_requirements": [
              "EAIMS-EVL-007"
            ],
            "insufficient_requirements": [
              "EAIMS-EVL-002"
            ],
            "minimum_evidence_class": "E2",
            "minimum_operating_cycles": 0,
            "minimum_adaptation_cycles": 0
          },
          "L4": {
            "eligible": false,
            "anchor_observed": false,
            "evidence_ok": false,
            "operating_cycles_ok": false,
            "adaptation_cycles_ok": true,
            "requirements_ok": false,
            "counter_evidence_ok": true,
            "missing_requirements": [
              "EAIMS-EVL-003",
              "EAIMS-EVL-004",
              "EAIMS-EVL-005",
              "EAIMS-EVL-006",
              "EAIMS-EVL-009"
            ],
            "failed_requirements": [
              "EAIMS-EVL-007"
            ],
            "insufficient_requirements": [
              "EAIMS-EVL-002"
            ],
            "minimum_evidence_class": "E3",
            "minimum_operating_cycles": 2,
            "minimum_adaptation_cycles": 0
          },
          "L5": {
            "eligible": false,
            "anchor_observed": false,
            "evidence_ok": false,
            "operating_cycles_ok": false,
            "adaptation_cycles_ok": false,
            "requirements_ok": false,
            "counter_evidence_ok": true,
            "missing_requirements": [
              "EAIMS-EVL-003",
              "EAIMS-EVL-004",
              "EAIMS-EVL-005",
              "EAIMS-EVL-006",
              "EAIMS-EVL-009",
              "EAIMS-EVL-010"
            ],
            "failed_requirements": [
              "EAIMS-EVL-007"
            ],
            "insufficient_requirements": [
              "EAIMS-EVL-002"
            ],
            "minimum_evidence_class": "E4",
            "minimum_operating_cycles": 2,
            "minimum_adaptation_cycles": 1
          }
        }
      },
      "higher_order_observations_preserved": [],
      "blocked_by": [
        "EAIMS-EVL-002",
        "EAIMS-EVL-007"
      ],
      "evidence_refs": [
        "EVD-RI01-003",
        "EVD-RI01-004"
      ]
    },
    {
      "capability_id": "DAT-03",
      "result": "L3",
      "confidence": "C3",
      "eligible_levels": {
        "L1": true,
        "L2": true,
        "L3": true,
        "L4": false,
        "L5": false
      },
      "anchor_eligibility_trace": {
        "mode": "capability_specific",
        "max_supporting_evidence_class": "E2",
        "operating_cycles": 0,
        "adaptation_cycles": 0,
        "counter_evidence_refs": [],
        "levels": {
          "L1": {
            "eligible": true,
            "anchor_observed": true,
            "evidence_ok": true,
            "operating_cycles_ok": true,
            "adaptation_cycles_ok": true,
            "requirements_ok": true,
            "counter_evidence_ok": true,
            "missing_requirements": [],
            "failed_requirements": [],
            "insufficient_requirements": [],
            "minimum_evidence_class": null,
            "minimum_operating_cycles": 0,
            "minimum_adaptation_cycles": 0
          },
          "L2": {
            "eligible": true,
            "anchor_observed": true,